{
    "$schema": "http://json-schema.org/draft-07/schema#",
    "definitions": {},
    "type": "object",
    "required": [
        "title",
        "cover",
        "describe"
    ],
    "properties": {
        "title": {
            "$ref": "./common_lang.json"
        },
        "describe": {
            "$ref": "./common_lang.json"
        },
        "hover": {
            "$ref": "./common_lang.json"
        },
        "cover": {
            "$ref": "./es_item.json"
        },
        "crafts": {
            "$ref": "./es_item.json"
        },
        "building": {
            "type": "object",
            "required": [
                "structure"
            ],
            "properties": {
                "structure": {
                    "type": "string"
                },
                "custom": {
                    "type": "object",
                    "patternProperties": {
                        "^-?\\d+,-?\\d+,-?\\d+$": {
                            "$ref": "./es_item.json"
                        },
                        "^-?\\d+,-?\\d+,-?\\d+->-?\\d+,-?\\d+,-?\\d+$": {
                            "$ref": "./es_item.json"
                        }
                    },
                    "additionalProperties": false
                },
                "customBuildings": {
                    "type": "object",
                    "patternProperties": {
                        "^-?\\d+,-?\\d+,-?\\d+$": {
                            "type": "string"
                        }
                    }
                }
            }
        }
    }
}