{
    "cover": "elementalsorcery:rite_table",
    "title": {
        "zh_CN": "知识§k????§r",
        "en_US": "Knowledge §k????§r"
    },
    "describe": {
        "zh_CN": "通过搭建仪式，消耗祭品作为魔力启动源，将知识在§k????§r的方式，可将史蒂夫们的智慧传递下去，称这个叫映像仪式。\\n想要实现这件事，首先需要一个仪式桌。仪式桌分为不同的等级，等级越高制作越难，目前只需要制作0级的即可。除了手中的石板，仪式桌上可以放五件物品作为祭品。\\n \\n仪式进行：仪式桌放到高一格的地面上，仪式桌为中心的5×5范围不能出现任何方块，仪式桌下方为中心的5×5范围内应插满鲜花或者火把，将祭品放到桌子上，手持满耐久的木剑发动仪式。仪式成功会有天雷将知识进行同步，并以卷轴的形式给予。如果失败后，会受到天罚，仪式等级越高收到的惩罚力度越大。\\n \\n祭品选择：大多数物品都可以成为祭品，物品的好坏决定着仪式的成败。但并不是每个等级的仪式都可以使用优秀的祭品，比如钻石。等级低的仪式只能接受普通的物品，当然对于等级低的仪式来说，这已经足够了。每种祭品有「能量」属性，所有祭品的能量综合越高，仪式的成功率越大。如果高级仪式使用低级仪式的祭品，物品所能提供的能量会大打折扣。\\n0级的仪式可以石头、原木、煤炭作为祭品，显然煤炭会更好一些，另外圆石是受到众人讨厌的祭品，如果使用5个煤炭作为祭品是肯定会成功的。我把可以作为祭品的详细数据放在了§k????§r",
        "en_US": "By Rite, consuming sacrifices as a source of magical power, and through the method of §k????§r knowledge, we can connect the wisdom of the Steves. We call this the Print Rite.\\nPrepare a Ritual Table to Start. There are diff level Ritual Tables, but now creft a 0 level is all right. In addition to the slate in hand, five items can be placed on the Ritual Table as sacrifices.\\n \\nRite: Put the Ritual Table on the ground one higher, Table center range of 5 × 5 cannot have any block. Place Flowers or torches on center range of 5x5 under table. Put the sacrifice on Ritual Table and start the Rite with a wooden sword. Steve Can get knowledge on Rite success. but if fail, steve will be punished, the higher Rite level, the greater the punishment received.\\n \\nSacrifice: Most items can be sacrificed, the quality of the items determine the success or failure of Rite. But not every level of table can withstand high-end items. Low level Rite can only accept low-end items, of course for low-level Rite, this is enough. Each sacrifice has 'Power' attribute, more Power more better. If high-level Rite use low-level's sacrifice, Power will be greatly reduced.\\n0 level Rite Can use Stone, Log, Coal as sacrifice, any level Rite hate cobblestone, and 5 coal will bring success in 0 level Rit.\\nI have put the detailed data that can be used as sacrifices in §k????§r"
    },
    "crafts": [
        {
            "id": "elementalsorcery:rite_table",
            "nbt": {
                "level": 0
            }
        }
    ]
}